{
  "version": 1,
  "name": "Rosé Pine",
  "author": "nukeop",
  "description": "All natural pine, faux fur and a bit of soho vibes for the classy minimalist.",
  "tags": ["warm", "muted", "elegant"],
  "palette": [
    "oklch(0.97 0.011 72)",
    "oklch(0.21 0.025 291)",
    "oklch(0.60 0.107 3)",
    "oklch(0.46 0.063 290)"
  ],
  "vars": {
    "background": "oklch(0.97 0.011 72)",
    "background-secondary": "oklch(0.99 0.011 77)",
    "background-input": "oklch(0.94 0.014 64)",

    "foreground": "oklch(0.46 0.063 290)",
    "foreground-secondary": "oklch(0.58 0.046 291)",
    "foreground-input": "oklch(0.46 0.063 290)",

    "primary": "oklch(0.60 0.107 3)",

    "border": "oklch(0.58 0.046 291)",
    "border-input": "oklch(0.67 0.027 298)",
    "ring": "oklch(0.60 0.107 3)",

    "accent-green": "oklch(0.63 0.066 210)",
    "accent-yellow": "oklch(0.76 0.146 70)",
    "accent-purple": "oklch(0.62 0.074 306)",
    "accent-blue": "oklch(0.49 0.077 228)",
    "accent-orange": "oklch(0.76 0.146 70)",
    "accent-cyan": "oklch(0.63 0.066 210)",
    "accent-red": "oklch(0.60 0.107 3)",

    "shadow-color": "oklch(0.58 0.046 291)",
    "shadow-x": "0px",
    "shadow-y": "1px",
    "shadow-blur": "2px",

    "radius-sm": "6px",
    "radius-md": "10px",
    "radius-lg": "14px",

    "border-width": "1px"
  },
  "dark": {
    "background": "oklch(0.21 0.025 291)",
    "background-secondary": "oklch(0.24 0.032 289)",
    "background-input": "oklch(0.18 0.020 291)",

    "foreground": "oklch(0.91 0.030 290)",
    "foreground-secondary": "oklch(0.65 0.044 291)",
    "foreground-input": "oklch(0.91 0.030 290)",

    "primary": "oklch(0.70 0.156 4)",

    "border": "oklch(0.54 0.044 291)",
    "border-input": "oklch(0.44 0.039 290)",

    "shadow-x": "0px",
    "shadow-y": "0px",
    "shadow-color": "oklch(0.12 0.015 291)"
  }
}
