{
  "version": 1,
  "name": "Gruvbox",
  "author": "nukeop",
  "description": "Retro groove color scheme. Based on the classic Vim theme.",
  "tags": ["retro", "warm"],
  "palette": [
    "oklch(0.96 0.055 96)",
    "oklch(0.28 0.000 263)",
    "oklch(0.62 0.171 46)",
    "oklch(0.34 0.007 48)"
  ],
  "vars": {
    "background": "oklch(0.96 0.055 96)",
    "background-secondary": "oklch(0.89 0.057 89)",
    "background-input": "oklch(0.96 0.055 96)",

    "foreground": "oklch(0.34 0.007 48)",
    "foreground-secondary": "oklch(0.48 0.018 61)",
    "foreground-input": "oklch(0.34 0.007 48)",

    "primary": "oklch(0.62 0.171 46)",

    "border": "oklch(0.41 0.011 52)",
    "border-input": "oklch(0.48 0.018 61)",
    "ring": "oklch(0.62 0.171 46)",

    "accent-green": "oklch(0.66 0.135 109)",
    "accent-yellow": "oklch(0.73 0.143 78)",
    "accent-purple": "oklch(0.60 0.111 352)",
    "accent-blue": "oklch(0.58 0.066 200)",
    "accent-orange": "oklch(0.62 0.171 46)",
    "accent-cyan": "oklch(0.65 0.094 145)",
    "accent-red": "oklch(0.55 0.203 29)",

    "shadow-color": "oklch(0.41 0.011 52)",
    "shadow-x": "2px",
    "shadow-y": "2px",
    "shadow-blur": "0px",

    "font-family": "'IBM Plex Mono', 'Space Mono', ui-monospace, monospace",
    "font-family-heading": "'IBM Plex Mono', 'Space Mono', ui-monospace, monospace",

    "radius-sm": "2px",
    "radius-md": "4px",
    "radius-lg": "6px",

    "border-width": "2px"
  },
  "dark": {
    "background": "oklch(0.28 0.000 263)",
    "background-secondary": "oklch(0.34 0.007 48)",
    "background-input": "oklch(0.24 0.000 263)",

    "foreground": "oklch(0.89 0.057 89)",
    "foreground-secondary": "oklch(0.69 0.035 76)",
    "foreground-input": "oklch(0.89 0.057 89)",

    "primary": "oklch(0.73 0.182 52)",

    "border": "oklch(0.48 0.018 61)",
    "border-input": "oklch(0.41 0.011 52)",

    "shadow-x": "0px",
    "shadow-y": "0px",
    "shadow-color": "oklch(0.15 0.000 0)"
  }
}
